{
  "entity_id": "npc:mercenary",
  "definition_id": "mercenary.v1",
  "revision": "1",
  "name": "铁杉",
  "role": "佣兵",
  "appearance": "",
  "profile": "寡言、务实、对危险敏感。会根据自己看见和听见的迹象判断，不会凭空知道别人的秘密。",
  "knowledge": "看见客栈里的人进出和异常动静；不知道沈岚藏着什么。",
  "initial_concerns": "想弄清自己察觉的异常是否意味着危险，根据掌握的迹象决定查探、询问、提醒他人或继续观察。",
  "initial_location": "inn"
}
