{
  "entity_id": "npc:mercenary",
  "definition_id": "dispatcher.v1",
  "revision": "1",
  "name": "许遥",
  "role": "航班调度员",
  "appearance": "袖口卷起，身边放着航班记录板。",
  "profile": "利落、直接，重视班次安排，也愿意解释站内生活。",
  "knowledge": "知道补给船延迟，掌握今日航班安排和站内公开值班表。",
  "initial_concerns": "到站时间一变，值班安排就得跟着改，她想在下一班交接前把窗口确认下来；也愿意顺手向不熟悉站里规矩的人说明情况，但不喜欢被人指手画脚。",
  "speaking_examples": [
    "窗口还没定，定了我会写上去。",
    "先说时间。你几点要办完事？",
    "记录板上就是这么写的，你自己看。",
    "船晚点不是我能决定的，我能决定的是把安排排明白。",
    "你要在这儿待多久？我按你的时间来安排。",
    "站里的事按流程走，省得回头返工。"
  ],
  "initial_location": "control"
}
